match,team_a,elo_a,source_elo_a,team_b,elo_b,source_elo_b,home_adv,form_adjust_a,source_form_a,injury_adjust_a,source_injury_a,weather_adjust,source_weather,mu_total,source_mu,actual_result,source_result,processing_notes,finetune_applied
Spain vs Cape Verde 2026-06-15,ESP,2157,eloratings.net / international-football.net 2026-06-15 snapshot,CPV,1578,eloratings.net / international-football.net 2026-06-15 snapshot,0,0.0,"RotoWire, SI, Sports Mole 2026-06-15 previews (rotation noted)",-25,"RotoWire, SI, Sports Mole 2026-06-15 (Yamal/Nico hamstring management, heavy rotation for MD1)",0.0,"NWS proxies, venue reports, previews (mild Atlanta dome, no extreme)",2.4,"v3 group stage default per AGENT.md §8 calibration + MD1 avg goals backtest (2.0 observed, adjusted to 2.4)",0-0,"Al Jazeera liveblog, ESPN, USA Today, FOX, Wikipedia Group H, Athletic 2026-06-15 (full-time reports, xG Spain ~2.1-2.3 vs CPV 0.2)",Base Elo gap 579 -> high p_win ~79%. Applied v3.1 Rule 21 finetunes (opener_draw_boost +0.055  minnow_resilience 1.16  rotation -25 Elo) per backtest introspection on Spain-CV shock and historical WC opener variance (2002 FRA-SEN precedent). See expected_lambdas and three_way_1x2 in pipeline. DC joints and sensitivities run for robustness.,Rule 21 opener/minnow/rotation; Rule 14 bias if applicable
Belgium vs Egypt 2026-06-15,BEL,1894,eloratings.net / international-football.net 2026-06-15 snapshot,EGY,1696,eloratings.net / international-football.net 2026-06-15 snapshot,0,8.0,"Previews (BEL strong attacking form, 18 goals in recent 5 per sources)",-8,"RotoWire, SI, Sports Mole, ESPN 2026-06-15 (Debast leg out, Doku fitness scare resolved, Lukaku bench/not starting)",-0.05,"NWS, previews (Seattle Lumen Field, record heat noted but milder than Miami; heat penalty applied per protocol)",2.35,v3 heat-adjusted for venue + MD reports (suppressed pressing/tempo),1-1,"Al Jazeera, ESPN, Wikipedia Group G, Athletic, FOX 2026-06-15 (Ashour opener, Hany OG equalizer; ref Abatti)",Base gap 198 -> p_win 63.6%. Minor form/injury/heat overlays per v3. Sensitivities run. DC for joints. Backtest vs actual draw validates variance in organized underdog (Egypt compact  Salah post-hamstring).,Rule 21 (mild); heat form
France vs Senegal 2026-06-16,FRA,2063,eloratings.net / international-football.net 2026-06-15 snapshot,SEN,1860,eloratings.net / international-football.net 2026-06-15 snapshot,0,0.0,Previews (FRA warmups mixed; dominant prep),-5,"ESPN, RotoWire, L'Équipe, Sports Mole 2026-06-15 (Kounde muscular monitor; Saliba back from back injury; Camavinga cut)",0.0,"NWS proxies, venue (MetLife NJ, mild ~82F, 15% rain, mid-afternoon)",2.55,"v3 quality-adjusted (Mendy GK discount per Rule 16, opposition regression)",N/A (upcoming at time of analysis),"N/A (pre-match data from ESPN, RotoWire, Yahoo, Fotmob, WhoScored, Al Jazeera, VG/fotball.no ~2026-06-15)",Base p_win 66.2%. Finisher pair bonus +25-30 Elo per Rule 15/20 (Mbappe + support). DC joints for combo. 3 sensitivities. HALT on high EV boosts per Rules 13/18. Lineup gate applied (multi-source consistent).,Rule 15/16/20 finisher/GK; Rule 21 mild; Rule 22 ensemble leg
Iraq vs Norway 2026-06-16,IRQ,1607,eloratings.net / international-football.net 2026-06-15 snapshot,NOR,1914,eloratings.net / international-football.net 2026-06-15 snapshot,0,0.0,Previews (IRQ mixed; NOR solid),0.0,"ESPN, Yahoo, RotoWire, Al Jazeera, WhoScored, Fotmob 2026-06-15 (NOR full strength; Haaland/Ødegaard fit/sharp per VG/fotball.no)",0.0,"NWS proxies, venue (Gillette Boston, benign mid-70s)",2.35,v3 default adjusted for mismatch,N/A (upcoming),"N/A (pre-match data from ESPN, Yahoo, RotoWire, Al Jazeera, WhoScored, Fotmob, VG/fotball.no ~2026-06-15)",Base p_DC (IRQ or D) 35.6% (Rule 14 uplift for longshot). Finisher pair +30 Elo (Haaland+Sørloth per Rule 15/20). High variance noted (Iraq parks bus precedent).,Rule 15/20 finisher; Rule 14 uplift; Rule 21 mild
Argentina vs Algeria 2026-06-16,ARG,2115,eloratings.net / international-football.net 2026-06-15 snapshot,ALG,1772,eloratings.net / international-football.net 2026-06-15 snapshot,0,0.0,Previews (ARG excellent; ALG solid),0.0,"RotoWire, Covers, SI, Fotmob, Yahoo, Sports Mole 2026-06-15 (ARG Messi confirmed starter; Bensebaini out for ALG; Alvarez minor cleared)",-0.02,"NWS proxies, venue (Arrowhead KC, upper 70s-30C, possible storms/humidity)",2.6,v3 quality-adjusted (high ARG λ),N/A (upcoming),"N/A (pre-match data from RotoWire, Covers, SI, Fotmob, Yahoo, Sports Mole, ESPN ~2026-06-15)",Base p_win 74%. Finisher bonus +25-30 (Messi depth + Alvarez per Rule 15/20). Extreme mismatch (ALG λ 0.09) makes BTTS joints low. CS streak discounted (low-quality opp per validator).,Rule 15/20 finisher; Rule 21 mild; Rule 16 GK if applicable
Austria vs Jordan 2026-06-16,AUT,1830,eloratings.net / international-football.net 2026-06-15 snapshot,JOR,1680,eloratings.net / international-football.net 2026-06-15 snapshot,0,-10.0,Previews (AUT quality but creator loss noted),-15,"Yahoo, VSIN, RotoWire, WhoScored, JuveFC, Sports Mole 2026-06-15 (AUT Baumgartner out thigh; Alaba fit caveat/monitor; Wimmer doubts; JOR Al-Naimat top striker out entire tournament knee)",0.0,"NWS proxies, venue (Levi's SF Bay, milder/cooler evening ~17% rain chance, benign vs others)",2.45,v3 default (milder venue supports low-block underdog),N/A (upcoming),"N/A (pre-match data from Yahoo, VSIN, RotoWire, WhoScored, JuveFC, Sports Mole, ESPN ~2026-06-15)",Base p_draw 23.2%. Creator loss (Baumgartner) + JOR low-block (Sellami/Morocco-2022 style) + debut motivation + milder weather -> data-aligned draw value. Rule 21 mild application.,Rule 21 (mild creator/debut); Rule 20 finisher caveats
